{
  "run_id": "ocm-run-3-bauspar",
  "tier": "CORE",
  "verdict": "PROVISIONAL",
  "emitted_utc": "2026-09-22T00:00:00Z",
  "caps": [
    {
      "rule": "R2",
      "absent_observation": "The real contract table (merged_data_with_tariff_amount) and the enrichment script that builds it. Neither is in the delivered bundle, and the downstream quality harness asserts the table's prior existence, so the source cannot be executed on real data as delivered.",
      "would_have_covered": "Input shape, layout, encoding and scale -- the layer the record blames for 6 of 10 failures, and the only layer this run could not observe at all. Specifically: whether the eleven columns exist under these names, which of them arrive already typed as dates, whether tariff_amount is a fraction or percent points (FND-02, a 100x exposure that is unknowable from this bundle), and whether contract identifiers repeat (UA-04).",
      "resulting_cap": "PROVISIONAL"
    },
    {
      "rule": "GR-09",
      "absent_observation": "A full-size run. Both sides observed 503 synthetic rows; production is 45,881 contracts.",
      "would_have_covered": "Memory behaviour and runtime under the declared budget. The target streams in blocks into column-oriented typed arrays and should scale, but 'should' is not 'did' and the gate is not claimed.",
      "resulting_cap": "PROVISIONAL"
    }
  ],
  "context_sharing": {
    "structural_barrier": true,
    "roles": [
      {
        "role": "controller",
        "context": "top-level session",
        "saw_source": true,
        "saw_target": true
      },
      {
        "role": "source agent",
        "context": "separate agent context A",
        "saw_source": true,
        "saw_target": false
      },
      {
        "role": "target agent",
        "context": "separate agent context B",
        "saw_source": false,
        "saw_target": true
      }
    ],
    "note": "The barrier was checked, not assumed. The target tree contains no file in the source language; a mechanical scan of all 21 of its modules is clean; the three source digests appear nowhere in its sources; and the controller deleted the build output, rebuilt from source and re-ran the program itself, reproducing all three digests. A target that had seen the answers could hard-code them but could not recompute them. The source's own OUTPUT on real data (customers_data.js, 45,881 contracts) was quarantined for the whole run and withheld even from the source agent during SPECIFY, so that the spec describes how to compute rather than what the answers are. Source checkpoint values were withheld from the target room until the target had emitted independently."
  },
  "waivers": [
    {
      "decision": "R20(b) source instrumentation deferred",
      "by": "protocol default, recorded",
      "risk_accepted": "No dynamic source-side effect interception or mutation metadata.",
      "mitigations": [
        "Layer 5 ran: the source was executed under R20(a) and both sides emitted independently",
        "R4 derived-quantity plausibility ran (P-13)"
      ]
    },
    {
      "decision": "GR-12/R9 corrected-behaviour switch mechanism stood down",
      "by": "owner (findings policy: faithful only)",
      "risk_accepted": "No corrected variant exists for any of the thirteen catalogued findings, and no delta report quantifies what correcting them would change.",
      "mitigations": [
        "Every finding carries an executable precondition that reports its exposure",
        "A divergence is then unambiguous: there is no legitimate reason for the two sides to differ"
      ]
    },
    {
      "decision": "GR-04 artifact browser and GR-05/GR-06 figure rendering not built",
      "by": "owner (tier: CORE)",
      "risk_accepted": "No interactive inspection of published objects and no rendered figures.",
      "mitigations": [
        "Stood down explicitly in the run's target directives rather than omitted silently",
        "Figure geometry is still specified and still checkpointed through the export object, because the positions are computed values"
      ]
    }
  ],
  "unverified_assumptions": [
    {
      "id": "UA-01",
      "statement": "The real input table carries these eleven columns under these names.",
      "precondition": "The names are what the unit DEMANDS, derived two independent ways that agree exactly. That is not evidence the real table supplies them.",
      "status": "open"
    },
    {
      "id": "UA-02",
      "statement": "Real inputs mix already-typed date columns with raw eight-digit ones as the unit's header comment describes.",
      "precondition": "Asserted by a comment only. R1 forbids treating a comment as evidence; no real file was available to check.",
      "status": "open"
    },
    {
      "id": "UA-03",
      "statement": "Real tariff values are fractions in (0,1] and an absent value means the tariff code found no match.",
      "precondition": "Inferred from the unit's use of the field. This is the substance of FND-02: if the real values are percent points, every saving goal in production has been 100x for as long as this version has run.",
      "status": "open"
    },
    {
      "id": "UA-04",
      "statement": "Contract identifiers are unique per row.",
      "precondition": "Enforced by the generator so the canonical order is total. The downstream harness takes the FIRST row for an identifier, which implies duplicates are expected in real data. Designed around rather than assumed away: both sides carry an emitter-added row index so the order stays total if identifiers repeat.",
      "status": "open"
    }
  ],
  "layers": [
    {
      "n": 1,
      "name": "Input profile",
      "tier": "CORE",
      "ran": true,
      "result": "FINDINGS",
      "findings": [
        "The staged file is rectangular at 11 fields under proper quoting; a naive delimiter split sees 11/14/15 and mis-assigns every column after the first amount. Recorded as a hazard for the target, which reproduced the two readings independently."
      ]
    },
    {
      "n": 2,
      "name": "Barrier scan",
      "tier": "CORE",
      "ran": true,
      "result": "PASS"
    },
    {
      "n": 3,
      "name": "Preconditions",
      "tier": "CORE",
      "ran": true,
      "result": "FINDINGS",
      "findings": [
        "P-01..P-13 all PASS, including parse-count reconciliation on all five date fields and the thousands-factor check (median ratio 0.975629, near 1)",
        "FND-08 FLAGGED: 27 contracts published in the ended phase while both the allocation and end dates were absent, reached through chained fallbacks, with nothing marking an estimated end",
        "FND-07 NOT_EXERCISED rather than vacuously passed: its entry point does not exist at CORE tier"
      ]
    },
    {
      "n": 4,
      "name": "Target checkpoints, cross-run",
      "tier": "CORE",
      "ran": true,
      "result": "PASS",
      "findings": [
        "Byte-identical across two runs with the timestamp pinned; re-verified by the controller after deleting the build output and rebuilding from source"
      ]
    },
    {
      "n": 5,
      "name": "Source-target checkpoint comparison",
      "tier": "CORE",
      "ran": true,
      "result": "PASS",
      "findings": [
        "3 of 3 objects byte-identical: customer_book 503x34, customer_export_rows 503x26, customers_js_document 507x2",
        "Input lists bound identically, so the two files are comparable under the canonicalisation contract section 7",
        "R20(a) satisfied: the source was executed, not described"
      ]
    },
    {
      "n": 6,
      "name": "Inversion self-tests",
      "tier": "CORE",
      "ran": true,
      "result": "PASS",
      "findings": [
        "89 checks, 89 passed, run before any artifact was written",
        "Includes the sixteen measured rounding vectors and an assertion that the rule DIFFERS from multiply-round-divide, which it does on two of them"
      ]
    },
    {
      "n": 7,
      "name": "Derived-quantity plausibility",
      "tier": "CORE",
      "ran": true,
      "result": "PASS",
      "findings": [
        "P-13: median of loan notional over bauspar sum = 0.975629, near 1, so the thousands factor is the right way up. A value near 0.001 or 1000 would mean the whole book's bridge flag had flipped."
      ]
    },
    {
      "n": 8,
      "name": "Schema validation",
      "tier": "CORE",
      "ran": true,
      "result": "PASS",
      "findings": [
        "Controller validated neutral_spec, flow_manifest, input_profile, checkpoints_source and checkpoints_target against their schemas"
      ]
    },
    {
      "n": 9,
      "name": "Build at declared level",
      "tier": "CORE",
      "ran": true,
      "result": "PASS",
      "findings": [
        "The declared level lives once in tsconfig.json and the build script reads it from there, then re-reads the compiler's effective configuration and asserts agreement",
        "Zero runtime dependencies; number formatting confined to one module and proved so by a build-time scan"
      ]
    },
    {
      "n": 10,
      "name": "Good-input control run",
      "tier": "FULL",
      "ran": true,
      "result": "PASS",
      "findings": [
        "Run although FULL-tier and not required: 26 checks over a known-good fixture, none reporting FAIL or FLAGGED, and eleven detectors asserted to separate good from bad input",
        "This is the layer whose absence produced two wolf-crying detectors in the previous run"
      ]
    },
    {
      "n": 11,
      "name": "Runtime trace",
      "tier": "FULL",
      "ran": false,
      "result": "NOT_RUN",
      "blocked_reason": "FULL-tier artifact; the owner chose CORE."
    },
    {
      "n": 12,
      "name": "Graph comparison",
      "tier": "FULL",
      "ran": false,
      "result": "NOT_RUN",